{
  "schemaVersion": 1,
  "master": "master.png",
  "assets": [
    {
      "id": "torso",
      "file": "assets/torso.png",
      "view": "three-quarter-side",
      "facing": "right",
      "depth": "center",
      "trimAlphaThreshold": 1,
      "placement": {
        "x": 385,
        "y": 171.75,
        "width": 225.75,
        "height": 312,
        "rotation": 0,
        "mirror": false
      },
      "landmarks": {
        "source0": [
          -4,
          3
        ],
        "source1": [
          164,
          313
        ]
      },
      "generation": {
        "mode": "builtin-imagegen",
        "prompt": "Use case: precise-object-edit. Input image is the EDIT TARGET. Make ONE targeted production correction ONLY to the TORSO in top row second column. Its near shoulder currently has a large hollow dark circular armhole with a thick outlined orange rim. This becomes an ugly exposed disk when the separate sleeve rotates forward. REPAINT that entire armhole interior AND all its inner concentric rim lines as smooth CONTINUOUS RUST-ORANGE JACKET FABRIC, with natural shoulder/underarm shading continuing from the chest. It must NOT look like a vest opening, cut tube, socket, circle, ring, disk or hole. This is hidden complete jacket material underneath the separate moving sleeve. Keep the outer silhouette and top shoulder panel, collar, zipper, chest, waist belt, hem, pose, dimensions and scale the same. Remove the oval-shaped internal outline across the filled area; no circle-shaped seam. No arm attached to torso: only repaint its exposed socket surface into unbroken cloth. ALL OTHER ELEVEN PARTS remain unchanged. Keep exact 1254x1254 sheet layout, flat magenta background, identity, materials and lighting. No labels or guides.\n",
        "reference": "master.png"
      },
      "sha256": "b79b5d73b4ec5d732d3ccf9ae64dbe66a8419688fec535393e8c700a459321f6",
      "normalizedFile": "assets/torso.png",
      "trim": {
        "x": 0,
        "y": 0,
        "width": 226,
        "height": 312,
        "originalWidth": 226,
        "originalHeight": 312
      }
    },
    {
      "id": "head",
      "file": "assets/head.png",
      "view": "three-quarter-side",
      "facing": "right",
      "depth": "center",
      "trimAlphaThreshold": 1,
      "placement": {
        "x": 445,
        "y": 78,
        "width": 124,
        "height": 154,
        "rotation": -0.19226699479857565,
        "mirror": false
      },
      "landmarks": {
        "source0": [
          173,
          124
        ],
        "source1": [
          113,
          243
        ]
      },
      "generation": {
        "mode": "builtin-imagegen",
        "prompt": "Use case: precise-object-edit. Input image is EDIT TARGET, a 12-part Spine cutout sheet. Make ONLY TWO corrections. 1) TOP LEFT HEAD: remove every bit of orange collar, zipper, shirt and clothing from this head cutout. Preserve exact face/hair/ears/beard, and complete a natural full bare neck down to a simple unoutlined hidden neck base. The separate torso already owns the collar, so the head must be just hair, face, beard and bare neck, NO clothing. Keep the head top and face scale at the existing location. 2) BOTTOM ROW SECOND COLUMN GREY PANTS: it incorrectly contains TWO attached trouser legs. Replace this component with EXACTLY ONE SINGLE LEFT trouser leg, inner-side view, from complete hidden hip root to ankle cuff. Remove the entire extra rear branch/second leg/crotch. A single long narrow trouser shaft with one thigh, one natural slightly bent knee and one calf, ONE ankle opening, no foot, no kneecap circles. Grey fabric and seam style identical to original. The outer silhouette has just one upper end and one lower end, no fork, notch, slit or Y shape. Keep this corrected single leg roughly in the right half of its former cell, x500–610 on the 1254x1254 sheet, from y700 to1190. Preserve ALL OTHER TEN PARTS including near leg, hands, torso, sleeves and boots unchanged. Preserve sheet dimensions and all layout positions, flat pure magenta #FF00FF background, style and lighting. No labels, extra parts, guides, pivots or shadows. Do not draw an assembled character.\n",
        "reference": "master.png"
      },
      "sha256": "e25567fe59170f65e882059ae38fbfeff32c6eaf5f644e7bb4524c8e7f303643",
      "normalizedFile": "assets/head.png",
      "trim": {
        "x": 0,
        "y": 0,
        "width": 124,
        "height": 154,
        "originalWidth": 124,
        "originalHeight": 154
      }
    },
    {
      "id": "upperNear",
      "file": "assets/upperNear.png",
      "view": "three-quarter-side",
      "facing": "right",
      "depth": "near",
      "anatomy": {
        "side": "right",
        "pair": "upper-arm",
        "surface": "outer"
      },
      "trimAlphaThreshold": 1,
      "placement": {
        "x": 339.14953339860114,
        "y": 216.81427252325722,
        "width": 130.91772053083434,
        "height": 212.15384455253152,
        "rotation": 5.125902944116847,
        "mirror": false
      },
      "landmarks": {
        "source0": [
          114,
          52
        ],
        "source1": [
          56,
          289
        ]
      },
      "generation": {
        "mode": "builtin-imagegen",